{
  "dataset": "treasury_snapshots",
  "analytics_as_of": "2026-03-20T20:14:44.603849Z",
  "as_of": "2026-03-20T20:14:44.603849Z",
  "version": 1,
  "records": [
    {
      "snapshot_id": "2026-03-20",
      "date": "2026-03-20",
      "wallet_address": "0x72ad986ebac0246d2b3c565ab2a1ce3a14ce6f88",
      "wallet_label": "Gnars DAO Treasury",
      "homepage_label_usd": 46500.0,
      "total_value_usd": 44736.99098223059,
      "display_widget_usd": 0.0,
      "assets": [
        {
          "symbol": "USDC",
          "amount": 21396.243942,
          "value_usd": 21394.703412436178
        },
        {
          "symbol": "SENDIT",
          "amount": 474092937.5544444,
          "value_usd": 4574.996847400389
        },
        {
          "symbol": "WETH",
          "amount": 0.02752447,
          "value_usd": 58.41710939389999
        },
        {
          "symbol": "GNARS",
          "amount": 562300.0,
          "value_usd": 8.74
        },
        {
          "symbol": "SKATEHACKER",
          "amount": 69400.0,
          "value_usd": 1.89
        },
        {
          "symbol": "ZIMARDRP",
          "amount": 111100.0,
          "value_usd": 1.37
        }
      ],
      "data_quality_note": "Homepage treasury label: 46500.0; treasury metric payload: 44736.99; visible treasury widget: 0.0. Use row-level holdings plus the metric payload as the reliable balance layer."
    }
  ]
}
